{
  "edges": [
    {
      "from": "episode:5250652d-f8da-5799-91da-8b1ce4991232",
      "to": "topic:public-radio",
      "type": "MENTIONS"
    },
    {
      "from": "episode:5250652d-f8da-5799-91da-8b1ce4991232",
      "to": "topic:journalism",
      "type": "MENTIONS"
    },
    {
      "from": "episode:5250652d-f8da-5799-91da-8b1ce4991232",
      "to": "topic:pronunciation",
      "type": "MENTIONS"
    },
    {
      "from": "episode:5250652d-f8da-5799-91da-8b1ce4991232",
      "to": "topic:reliability",
      "type": "MENTIONS"
    },
    {
      "from": "episode:5250652d-f8da-5799-91da-8b1ce4991232",
      "to": "topic:environment",
      "type": "MENTIONS"
    },
    {
      "from": "episode:5250652d-f8da-5799-91da-8b1ce4991232",
      "to": "topic:technology",
      "type": "MENTIONS"
    },
    {
      "from": "episode:5250652d-f8da-5799-91da-8b1ce4991232",
      "to": "topic:technology",
      "type": "MENTIONS"
    },
    {
      "from": "episode:5250652d-f8da-5799-91da-8b1ce4991232",
      "to": "insight:6a77e36d51b1d25d",
      "type": "HAS_INSIGHT"
    },
    {
      "from": "insight:6a77e36d51b1d25d",
      "to": "topic:pronunciation",
      "type": "ABOUT"
    },
    {
      "from": "insight:6a77e36d51b1d25d",
      "to": "topic:reliability",
      "type": "ABOUT"
    },
    {
      "from": "episode:5250652d-f8da-5799-91da-8b1ce4991232",
      "to": "insight:e84a13fb6e0bae28",
      "type": "HAS_INSIGHT"
    },
    {
      "from": "episode:5250652d-f8da-5799-91da-8b1ce4991232",
      "to": "insight:db9acd5ee7759839",
      "type": "HAS_INSIGHT"
    },
    {
      "from": "quote:bcdda3112267f8ad",
      "to": "person:speaker-02",
      "type": "SPOKEN_BY"
    },
    {
      "from": "insight:6a77e36d51b1d25d",
      "to": "quote:bcdda3112267f8ad",
      "type": "SUPPORTED_BY"
    },
    {
      "from": "quote:7b6a126e7c761dfa",
      "to": "person:speaker-01",
      "type": "SPOKEN_BY"
    },
    {
      "from": "insight:e84a13fb6e0bae28",
      "to": "quote:7b6a126e7c761dfa",
      "type": "SUPPORTED_BY"
    },
    {
      "from": "quote:d087ca560a046037",
      "to": "person:speaker-01",
      "type": "SPOKEN_BY"
    },
    {
      "from": "insight:db9acd5ee7759839",
      "to": "quote:d087ca560a046037",
      "type": "SUPPORTED_BY"
    },
    {
      "from": "quote:237866e6b2b9486d",
      "to": "person:speaker-01",
      "type": "SPOKEN_BY"
    },
    {
      "from": "insight:6a77e36d51b1d25d",
      "to": "quote:237866e6b2b9486d",
      "type": "SUPPORTED_BY"
    },
    {
      "from": "quote:51fc246f0cb104b9",
      "to": "person:speaker-02",
      "type": "SPOKEN_BY"
    },
    {
      "from": "insight:e84a13fb6e0bae28",
      "to": "quote:51fc246f0cb104b9",
      "type": "SUPPORTED_BY"
    },
    {
      "from": "quote:9b5975507018202d",
      "to": "person:speaker-01",
      "type": "SPOKEN_BY"
    },
    {
      "from": "insight:db9acd5ee7759839",
      "to": "quote:9b5975507018202d",
      "type": "SUPPORTED_BY"
    },
    {
      "from": "insight:6a77e36d51b1d25d",
      "to": "person:speaker-01",
      "type": "MENTIONS_PERSON"
    },
    {
      "from": "insight:e84a13fb6e0bae28",
      "to": "person:speaker-02",
      "type": "MENTIONS_PERSON"
    },
    {
      "from": "insight:db9acd5ee7759839",
      "to": "person:speaker-01",
      "type": "MENTIONS_PERSON"
    }
  ],
  "episode_id": "5250652d-f8da-5799-91da-8b1ce4991232",
  "model_version": "synthetic-validation-corpus-v1",
  "nodes": [
    {
      "id": "episode:5250652d-f8da-5799-91da-8b1ce4991232",
      "properties": {
        "duration_ms": 1800000,
        "feed_id": "sha256:c5df4ffdf9a45b0c75fbcf3b416e78ac14f7a8af21d0155471f55502c7c01bcc",
        "podcast_id": "sha256:c5df4ffdf9a45b0c75fbcf3b416e78ac14f7a8af21d0155471f55502c7c01bcc",
        "publish_date": "2026-09-21T12:00:00",
        "title": "Public Hour \u2014 Episode 2"
      },
      "type": "Episode"
    },
    {
      "id": "topic:public-radio",
      "properties": {
        "label": "public radio"
      },
      "type": "Topic"
    },
    {
      "id": "topic:journalism",
      "properties": {
        "label": "journalism"
      },
      "type": "Topic"
    },
    {
      "id": "topic:pronunciation",
      "properties": {
        "label": "pronunciation"
      },
      "type": "Topic"
    },
    {
      "id": "topic:reliability",
      "properties": {
        "label": "reliability"
      },
      "type": "Topic"
    },
    {
      "id": "topic:environment",
      "properties": {
        "label": "environment"
      },
      "type": "Topic"
    },
    {
      "id": "topic:technology",
      "properties": {
        "label": "technology"
      },
      "type": "Topic"
    },
    {
      "id": "topic:technology",
      "properties": {
        "label": "Technology"
      },
      "type": "Topic"
    },
    {
      "id": "insight:6a77e36d51b1d25d",
      "properties": {
        "episode_id": "5250652d-f8da-5799-91da-8b1ce4991232",
        "grounded": true,
        "insight_type": "claim",
        "position_hint": 0.2,
        "text": "# Public Hour \u2014 Episode\n## Pronunciation as a Reliability Signal\nHost: A."
      },
      "type": "Insight"
    },
    {
      "id": "insight:e84a13fb6e0bae28",
      "properties": {
        "episode_id": "5250652d-f8da-5799-91da-8b1ce4991232",
        "grounded": true,
        "insight_type": "observation",
        "position_hint": 0.35,
        "text": "correspondent\nGuest: Renee Montague-Park\n#fixture-v3: failure_modes=zero_host_ner,recurring_guest\n#fixture-v3: voice=en-US host_voice=en-US\nA."
      },
      "type": "Insight"
    },
    {
      "id": "insight:db9acd5ee7759839",
      "properties": {
        "episode_id": "5250652d-f8da-5799-91da-8b1ce4991232",
        "grounded": true,
        "insight_type": "recommendation",
        "position_hint": 0.5,
        "text": "correspondent: Welcome back to Public Hour."
      },
      "type": "Insight"
    },
    {
      "id": "person:speaker-02",
      "properties": {
        "name": "Renee Montague-Park"
      },
      "type": "Person"
    },
    {
      "id": "quote:bcdda3112267f8ad",
      "properties": {
        "char_end": 246,
        "char_start": 203,
        "episode_id": "5250652d-f8da-5799-91da-8b1ce4991232",
        "speaker_id": "person:speaker-02",
        "text": "Thanks, A. correspondent. Great to be back.",
        "timestamp_end_ms": 12000,
        "timestamp_start_ms": 6000,
        "transcript_ref": "transcripts/p08_e02.txt"
      },
      "type": "Quote"
    },
    {
      "id": "person:speaker-01",
      "properties": {
        "name": "A. correspondent"
      },
      "type": "Person"
    },
    {
      "id": "quote:7b6a126e7c761dfa",
      "properties": {
        "char_end": 426,
        "char_start": 265,
        "episode_id": "5250652d-f8da-5799-91da-8b1ce4991232",
        "speaker_id": "person:speaker-01",
        "text": "This episode is brought to you by Squarespace. Squarespace makes building a beautiful, branded website actually pleasant. Get started at squarespace.com/podcast.",
        "timestamp_end_ms": 18000,
        "timestamp_start_ms": 12000,
        "transcript_ref": "transcripts/p08_e02.txt"
      },
      "type": "Quote"
    },
    {
      "id": "quote:d087ca560a046037",
      "properties": {
        "char_end": 520,
        "char_start": 426,
        "episode_id": "5250652d-f8da-5799-91da-8b1ce4991232",
        "speaker_id": "person:speaker-01",
        "text": "Before we get into it \u2014 Renee was on last week walking through public-radio voice conventions.",
        "timestamp_end_ms": 24000,
        "timestamp_start_ms": 18000,
        "transcript_ref": "transcripts/p08_e02.txt"
      },
      "type": "Quote"
    },
    {
      "id": "quote:237866e6b2b9486d",
      "properties": {
        "char_end": 714,
        "char_start": 619,
        "episode_id": "5250652d-f8da-5799-91da-8b1ce4991232",
        "speaker_id": "person:speaker-01",
        "text": "What does the failure mode look like? What's the version of the question that actually matters?",
        "timestamp_end_ms": 36000,
        "timestamp_start_ms": 30000,
        "transcript_ref": "transcripts/p08_e02.txt"
      },
      "type": "Quote"
    },
    {
      "id": "quote:51fc246f0cb104b9",
      "properties": {
        "char_end": 977,
        "char_start": 736,
        "episode_id": "5250652d-f8da-5799-91da-8b1ce4991232",
        "speaker_id": "person:speaker-02",
        "text": "It comes down to this: Mispronunciation is a high-signal mistake \u2014 it tells listeners 'this person isn't paying attention'. We've seen this play out at teams using BBC. The framing matters because it tells you which trade-offs you're making.",
        "timestamp_end_ms": 42000,
        "timestamp_start_ms": 36000,
        "transcript_ref": "transcripts/p08_e02.txt"
      },
      "type": "Quote"
    },
    {
      "id": "quote:9b5975507018202d",
      "properties": {
        "char_end": 1109,
        "char_start": 996,
        "episode_id": "5250652d-f8da-5799-91da-8b1ce4991232",
        "speaker_id": "person:speaker-01",
        "text": "Push back on the conventional wisdom for me. What's something you used to believe about this that you've revised?",
        "timestamp_end_ms": 48000,
        "timestamp_start_ms": 42000,
        "transcript_ref": "transcripts/p08_e02.txt"
      },
      "type": "Quote"
    }
  ],
  "prompt_version": "n/a",
  "schema_version": "3.1"
}
