{
  "edges": [
    {
      "from": "episode:e1743bda-76ff-5586-9e39-3fa45e41ef9a",
      "to": "topic:lighting-design",
      "type": "MENTIONS"
    },
    {
      "from": "episode:e1743bda-76ff-5586-9e39-3fa45e41ef9a",
      "to": "topic:strobe-lighting",
      "type": "MENTIONS"
    },
    {
      "from": "episode:e1743bda-76ff-5586-9e39-3fa45e41ef9a",
      "to": "topic:frame",
      "type": "MENTIONS"
    },
    {
      "from": "episode:e1743bda-76ff-5586-9e39-3fa45e41ef9a",
      "to": "topic:technology",
      "type": "MENTIONS"
    },
    {
      "from": "episode:e1743bda-76ff-5586-9e39-3fa45e41ef9a",
      "to": "topic:gear",
      "type": "MENTIONS"
    },
    {
      "from": "episode:e1743bda-76ff-5586-9e39-3fa45e41ef9a",
      "to": "topic:business-markets",
      "type": "MENTIONS"
    },
    {
      "from": "episode:e1743bda-76ff-5586-9e39-3fa45e41ef9a",
      "to": "insight:4c10d2d79f5222d3",
      "type": "HAS_INSIGHT"
    },
    {
      "from": "insight:4c10d2d79f5222d3",
      "to": "topic:lighting-design",
      "type": "ABOUT"
    },
    {
      "from": "episode:e1743bda-76ff-5586-9e39-3fa45e41ef9a",
      "to": "insight:772e9d7736e683de",
      "type": "HAS_INSIGHT"
    },
    {
      "from": "episode:e1743bda-76ff-5586-9e39-3fa45e41ef9a",
      "to": "insight:1f363af5c9b5d0ec",
      "type": "HAS_INSIGHT"
    },
    {
      "from": "quote:a832e074c5b4630e",
      "to": "person:speaker-02",
      "type": "SPOKEN_BY"
    },
    {
      "from": "insight:4c10d2d79f5222d3",
      "to": "quote:a832e074c5b4630e",
      "type": "SUPPORTED_BY"
    },
    {
      "from": "quote:e2f31026d8533440",
      "to": "person:speaker-01",
      "type": "SPOKEN_BY"
    },
    {
      "from": "insight:772e9d7736e683de",
      "to": "quote:e2f31026d8533440",
      "type": "SUPPORTED_BY"
    },
    {
      "from": "quote:c5ce477ee6758691",
      "to": "person:speaker-01",
      "type": "SPOKEN_BY"
    },
    {
      "from": "insight:1f363af5c9b5d0ec",
      "to": "quote:c5ce477ee6758691",
      "type": "SUPPORTED_BY"
    },
    {
      "from": "quote:0b3260573971416e",
      "to": "person:speaker-02",
      "type": "SPOKEN_BY"
    },
    {
      "from": "insight:4c10d2d79f5222d3",
      "to": "quote:0b3260573971416e",
      "type": "SUPPORTED_BY"
    },
    {
      "from": "quote:c0d50be565a2b1d2",
      "to": "person:speaker-01",
      "type": "SPOKEN_BY"
    },
    {
      "from": "insight:772e9d7736e683de",
      "to": "quote:c0d50be565a2b1d2",
      "type": "SUPPORTED_BY"
    },
    {
      "from": "quote:a5e93f2ba680e172",
      "to": "person:speaker-02",
      "type": "SPOKEN_BY"
    },
    {
      "from": "insight:1f363af5c9b5d0ec",
      "to": "quote:a5e93f2ba680e172",
      "type": "SUPPORTED_BY"
    },
    {
      "from": "insight:4c10d2d79f5222d3",
      "to": "person:speaker-01",
      "type": "MENTIONS_PERSON"
    },
    {
      "from": "insight:772e9d7736e683de",
      "to": "person:speaker-02",
      "type": "MENTIONS_PERSON"
    },
    {
      "from": "insight:1f363af5c9b5d0ec",
      "to": "person:speaker-01",
      "type": "MENTIONS_PERSON"
    }
  ],
  "episode_id": "e1743bda-76ff-5586-9e39-3fa45e41ef9a",
  "model_version": "synthetic-validation-corpus-v1",
  "nodes": [
    {
      "id": "episode:e1743bda-76ff-5586-9e39-3fa45e41ef9a",
      "properties": {
        "duration_ms": 1800000,
        "feed_id": "sha256:bc193c384cef2911f2202fdb5f0d8f96abf7e2a26d957bac0ec0c1d13825f34d",
        "podcast_id": "sha256:bc193c384cef2911f2202fdb5f0d8f96abf7e2a26d957bac0ec0c1d13825f34d",
        "publish_date": "2026-09-23T12:00:00",
        "title": "Frame & Light \u2014 Episode 3"
      },
      "type": "Episode"
    },
    {
      "id": "topic:lighting-design",
      "properties": {
        "label": "lighting design"
      },
      "type": "Topic"
    },
    {
      "id": "topic:strobe-lighting",
      "properties": {
        "label": "strobe lighting"
      },
      "type": "Topic"
    },
    {
      "id": "topic:frame",
      "properties": {
        "label": "frame"
      },
      "type": "Topic"
    },
    {
      "id": "topic:technology",
      "properties": {
        "label": "technology"
      },
      "type": "Topic"
    },
    {
      "id": "topic:gear",
      "properties": {
        "label": "gear"
      },
      "type": "Topic"
    },
    {
      "id": "topic:business-markets",
      "properties": {
        "label": "Business & markets"
      },
      "type": "Topic"
    },
    {
      "id": "insight:4c10d2d79f5222d3",
      "properties": {
        "episode_id": "e1743bda-76ff-5586-9e39-3fa45e41ef9a",
        "grounded": true,
        "insight_type": "claim",
        "position_hint": 0.2,
        "text": "Today we're talking about lighting design, and I'm joined by Daniel Olufemi, commercial lighting director."
      },
      "type": "Insight"
    },
    {
      "id": "insight:772e9d7736e683de",
      "properties": {
        "episode_id": "e1743bda-76ff-5586-9e39-3fa45e41ef9a",
        "grounded": true,
        "insight_type": "observation",
        "position_hint": 0.35,
        "text": "Daniel Olufemi, thanks for being here."
      },
      "type": "Insight"
    },
    {
      "id": "insight:1f363af5c9b5d0ec",
      "properties": {
        "episode_id": "e1743bda-76ff-5586-9e39-3fa45e41ef9a",
        "grounded": true,
        "insight_type": "recommendation",
        "position_hint": 0.5,
        "text": "This episode is brought to you by Adobe."
      },
      "type": "Insight"
    },
    {
      "id": "person:speaker-02",
      "properties": {
        "name": "Daniel Olufemi"
      },
      "type": "Person"
    },
    {
      "id": "quote:a832e074c5b4630e",
      "properties": {
        "char_end": 228,
        "char_start": 198,
        "episode_id": "e1743bda-76ff-5586-9e39-3fa45e41ef9a",
        "speaker_id": "person:speaker-02",
        "text": "Thanks, Leo. Great to be back.",
        "timestamp_end_ms": 12000,
        "timestamp_start_ms": 6000,
        "transcript_ref": "transcripts/p04_e03.txt"
      },
      "type": "Quote"
    },
    {
      "id": "person:speaker-01",
      "properties": {
        "name": "Leo"
      },
      "type": "Person"
    },
    {
      "id": "quote:e2f31026d8533440",
      "properties": {
        "char_end": 386,
        "char_start": 234,
        "episode_id": "e1743bda-76ff-5586-9e39-3fa45e41ef9a",
        "speaker_id": "person:speaker-01",
        "text": "This episode is brought to you by Adobe. Adobe Creative Cloud puts Lightroom, Photoshop, and Premiere on every device. Get started at adobe.com/podcast.",
        "timestamp_end_ms": 18000,
        "timestamp_start_ms": 12000,
        "transcript_ref": "transcripts/p04_e03.txt"
      },
      "type": "Quote"
    },
    {
      "id": "quote:c5ce477ee6758691",
      "properties": {
        "char_end": 490,
        "char_start": 386,
        "episode_id": "e1743bda-76ff-5586-9e39-3fa45e41ef9a",
        "speaker_id": "person:speaker-01",
        "text": "Walk me through a concrete example. What's something you used to believe about this that you've revised?",
        "timestamp_end_ms": 24000,
        "timestamp_start_ms": 18000,
        "transcript_ref": "transcripts/p04_e03.txt"
      },
      "type": "Quote"
    },
    {
      "id": "quote:0b3260573971416e",
      "properties": {
        "char_end": 723,
        "char_start": 507,
        "episode_id": "e1743bda-76ff-5586-9e39-3fa45e41ef9a",
        "speaker_id": "person:speaker-02",
        "text": "Here's how I think about it. On location, the first decision is always: am I shaping the existing light? We've seen this play out at teams using Adobe. Once you internalize that, the rest of the decisions get easier.",
        "timestamp_end_ms": 30000,
        "timestamp_start_ms": 24000,
        "transcript_ref": "transcripts/p04_e03.txt"
      },
      "type": "Quote"
    },
    {
      "id": "quote:c0d50be565a2b1d2",
      "properties": {
        "char_end": 793,
        "char_start": 729,
        "episode_id": "e1743bda-76ff-5586-9e39-3fa45e41ef9a",
        "speaker_id": "person:speaker-01",
        "text": "That's a useful framing. How does Profoto fit into this picture?",
        "timestamp_end_ms": 36000,
        "timestamp_start_ms": 30000,
        "transcript_ref": "transcripts/p04_e03.txt"
      },
      "type": "Quote"
    },
    {
      "id": "quote:a5e93f2ba680e172",
      "properties": {
        "char_end": 929,
        "char_start": 810,
        "episode_id": "e1743bda-76ff-5586-9e39-3fa45e41ef9a",
        "speaker_id": "person:speaker-02",
        "text": "Yeah, so \u2014 Two-light setups solve 80% of commercial problems. And the second-order effect is the part most people miss.",
        "timestamp_end_ms": 42000,
        "timestamp_start_ms": 36000,
        "transcript_ref": "transcripts/p04_e03.txt"
      },
      "type": "Quote"
    }
  ],
  "prompt_version": "n/a",
  "schema_version": "3.1"
}
